{
  "schema_version": "0.1",
  "model_id": "ambulance-crews-2026-w46",
  "model_version": 1,
  "assignments": [
    {"task_id": "09-Π-Ο", "resource_id": "Ε03"},
    {"task_id": "09-Π-Ο", "resource_id": "Ε04"},
    {"task_id": "09-Π-Δ", "resource_id": "Ε08"},
    {"task_id": "09-Π-Δ", "resource_id": "Ε12"},
    {"task_id": "09-Α-Ο", "resource_id": "Ε05"},
    {"task_id": "09-Α-Δ", "resource_id": "Ε02"},
    {"task_id": "09-Ν-Ο", "resource_id": "Ε07"},
    {"task_id": "09-Ν-Δ", "resource_id": "Ε10"},
    {"task_id": "10-Π-Ο", "resource_id": "Ε01"},
    {"task_id": "10-Π-Ο", "resource_id": "Ε06"},
    {"task_id": "10-Π-Δ", "resource_id": "Ε08"},
    {"task_id": "10-Π-Δ", "resource_id": "Ε12"},
    {"task_id": "10-Α-Ο", "resource_id": "Ε03"},
    {"task_id": "10-Α-Δ", "resource_id": "Ε09"},
    {"task_id": "10-Ν-Ο", "resource_id": "Ε04"},
    {"task_id": "10-Ν-Δ", "resource_id": "Ε11"},
    {"task_id": "11-Π-Ο", "resource_id": "Ε02"},
    {"task_id": "11-Π-Ο", "resource_id": "Ε06"},
    {"task_id": "11-Π-Δ", "resource_id": "Ε01"},
    {"task_id": "11-Π-Δ", "resource_id": "Ε08"},
    {"task_id": "11-Α-Ο", "resource_id": "Ε05"},
    {"task_id": "11-Α-Δ", "resource_id": "Ε09"},
    {"task_id": "11-Ν-Ο", "resource_id": "Ε03"},
    {"task_id": "11-Ν-Δ", "resource_id": "Ε12"},
    {"task_id": "12-Π-Ο", "resource_id": "Ε02"},
    {"task_id": "12-Π-Ο", "resource_id": "Ε07"},
    {"task_id": "12-Π-Δ", "resource_id": "Ε08"},
    {"task_id": "12-Π-Δ", "resource_id": "Ε10"},
    {"task_id": "12-Α-Ο", "resource_id": "Ε01"},
    {"task_id": "12-Α-Δ", "resource_id": "Ε05"},
    {"task_id": "12-Ν-Ο", "resource_id": "Ε06"},
    {"task_id": "12-Ν-Δ", "resource_id": "Ε09"},
    {"task_id": "13-Π-Ο", "resource_id": "Ε02"},
    {"task_id": "13-Π-Ο", "resource_id": "Ε07"},
    {"task_id": "13-Π-Δ", "resource_id": "Ε10"},
    {"task_id": "13-Π-Δ", "resource_id": "Ε11"},
    {"task_id": "13-Α-Ο", "resource_id": "Ε05"},
    {"task_id": "13-Α-Δ", "resource_id": "Ε03"},
    {"task_id": "13-Ν-Ο", "resource_id": "Ε01"},
    {"task_id": "13-Ν-Δ", "resource_id": "Ε08"},
    {"task_id": "14-Π-Ο", "resource_id": "Ε02"},
    {"task_id": "14-Π-Ο", "resource_id": "Ε07"},
    {"task_id": "14-Π-Δ", "resource_id": "Ε11"},
    {"task_id": "14-Π-Δ", "resource_id": "Ε12"},
    {"task_id": "14-Α-Ο", "resource_id": "Ε06"},
    {"task_id": "14-Α-Δ", "resource_id": "Ε05"},
    {"task_id": "14-Ν-Ο", "resource_id": "Ε03"},
    {"task_id": "14-Ν-Δ", "resource_id": "Ε10"},
    {"task_id": "15-Π-Ο", "resource_id": "Ε02"},
    {"task_id": "15-Π-Ο", "resource_id": "Ε07"},
    {"task_id": "15-Π-Δ", "resource_id": "Ε08"},
    {"task_id": "15-Π-Δ", "resource_id": "Ε09"},
    {"task_id": "15-Α-Ο", "resource_id": "Ε05"},
    {"task_id": "15-Α-Δ", "resource_id": "Ε11"},
    {"task_id": "15-Ν-Ο", "resource_id": "Ε04"},
    {"task_id": "15-Ν-Δ", "resource_id": "Ε12"}
  ],
  "metadata": {"produced_by": "TASK-005b review reference search (exact, checker as oracle)", "notes": "exact optimum: CP-SAT over the hard rules with the checker's soft objective, every solution re-scored by potakt check; among the optimal plans, the one closest to the previous reference in which Ε10 works during the disruption window, with the fewest breaks of the night-off wish"}
}
