{
  "schema_version": "0.1",
  "model_id": "hotel-reception-2026-w48",
  "model_version": 1,
  "assignments": [
    {"task_id": "ΔΕ23-Π", "resource_id": "Υ2"},
    {"task_id": "ΔΕ23-Π", "resource_id": "Υ4"},
    {"task_id": "ΔΕ23-Α", "resource_id": "Υ5"},
    {"task_id": "ΔΕ23-Α", "resource_id": "Υ7"},
    {"task_id": "ΔΕ23-Ν", "resource_id": "Υ8"},
    {"task_id": "ΤΡ24-Π", "resource_id": "Υ1"},
    {"task_id": "ΤΡ24-Π", "resource_id": "Υ2"},
    {"task_id": "ΤΡ24-Α", "resource_id": "Υ3"},
    {"task_id": "ΤΡ24-Α", "resource_id": "Υ6"},
    {"task_id": "ΤΡ24-Ν", "resource_id": "Υ5"},
    {"task_id": "ΤΕ25-Π", "resource_id": "Υ1"},
    {"task_id": "ΤΕ25-Π", "resource_id": "Υ2"},
    {"task_id": "ΤΕ25-Α", "resource_id": "Υ3"},
    {"task_id": "ΤΕ25-Α", "resource_id": "Υ6"},
    {"task_id": "ΤΕ25-Ν", "resource_id": "Υ4"},
    {"task_id": "ΠΕ26-Π", "resource_id": "Υ1"},
    {"task_id": "ΠΕ26-Π", "resource_id": "Υ7"},
    {"task_id": "ΠΕ26-Α", "resource_id": "Υ6"},
    {"task_id": "ΠΕ26-Α", "resource_id": "Υ8"},
    {"task_id": "ΠΕ26-Ν", "resource_id": "Υ3"},
    {"task_id": "ΠΑ27-Π", "resource_id": "Υ2"},
    {"task_id": "ΠΑ27-Π", "resource_id": "Υ5"},
    {"task_id": "ΠΑ27-Α", "resource_id": "Υ4"},
    {"task_id": "ΠΑ27-Α", "resource_id": "Υ8"},
    {"task_id": "ΠΑ27-Ν", "resource_id": "Υ1"},
    {"task_id": "ΣΑ28-Π", "resource_id": "Υ2"},
    {"task_id": "ΣΑ28-Π", "resource_id": "Υ5"},
    {"task_id": "ΣΑ28-Α", "resource_id": "Υ3"},
    {"task_id": "ΣΑ28-Α", "resource_id": "Υ4"},
    {"task_id": "ΣΑ28-Ν", "resource_id": "Υ6"},
    {"task_id": "ΚΥ29-Π", "resource_id": "Υ1"},
    {"task_id": "ΚΥ29-Π", "resource_id": "Υ8"},
    {"task_id": "ΚΥ29-Α", "resource_id": "Υ3"},
    {"task_id": "ΚΥ29-Α", "resource_id": "Υ4"},
    {"task_id": "ΚΥ29-Ν", "resource_id": "Υ7"}
  ],
  "metadata": {"produced_by": "TASK-005a reference search (checker as oracle)", "notes": "simulated annealing, 25000 iterations, seed 2, objective = potakt checker score (hard x 10000 + soft); best found, not proven optimal"}
}
