{
  "schema_version": "0.1",
  "model_id": "clinic-el-2026-w45",
  "model_version": 1,
  "assignments": [
    {"task_id": "2026-11-02-proi", "resource_id": "n4"},
    {"task_id": "2026-11-02-proi", "resource_id": "n5"},
    {"task_id": "2026-11-02-apogevma", "resource_id": "n1"},
    {"task_id": "2026-11-02-apogevma", "resource_id": "n3"},
    {"task_id": "2026-11-02-nychta", "resource_id": "n2"},
    {"task_id": "2026-11-03-proi", "resource_id": "n4"},
    {"task_id": "2026-11-03-proi", "resource_id": "n6"},
    {"task_id": "2026-11-03-apogevma", "resource_id": "n1"},
    {"task_id": "2026-11-03-apogevma", "resource_id": "n5"},
    {"task_id": "2026-11-03-nychta", "resource_id": "n3"},
    {"task_id": "2026-11-04-proi", "resource_id": "n2"},
    {"task_id": "2026-11-04-proi", "resource_id": "n6"},
    {"task_id": "2026-11-04-apogevma", "resource_id": "n4"},
    {"task_id": "2026-11-04-apogevma", "resource_id": "n5"},
    {"task_id": "2026-11-04-nychta", "resource_id": "n3"},
    {"task_id": "2026-11-05-proi", "resource_id": "n1"},
    {"task_id": "2026-11-05-proi", "resource_id": "n2"},
    {"task_id": "2026-11-05-apogevma", "resource_id": "n4"},
    {"task_id": "2026-11-05-apogevma", "resource_id": "n6"},
    {"task_id": "2026-11-05-nychta", "resource_id": "n3"},
    {"task_id": "2026-11-06-proi", "resource_id": "n2"},
    {"task_id": "2026-11-06-proi", "resource_id": "n5"},
    {"task_id": "2026-11-06-apogevma", "resource_id": "n4"},
    {"task_id": "2026-11-06-apogevma", "resource_id": "n6"},
    {"task_id": "2026-11-06-nychta", "resource_id": "n1"},
    {"task_id": "2026-11-07-proi", "resource_id": "n2"},
    {"task_id": "2026-11-07-proi", "resource_id": "n3"},
    {"task_id": "2026-11-07-apogevma", "resource_id": "n4"},
    {"task_id": "2026-11-07-apogevma", "resource_id": "n6"},
    {"task_id": "2026-11-07-nychta", "resource_id": "n1"},
    {"task_id": "2026-11-08-proi", "resource_id": "n2"},
    {"task_id": "2026-11-08-proi", "resource_id": "n5"},
    {"task_id": "2026-11-08-apogevma", "resource_id": "n3"},
    {"task_id": "2026-11-08-apogevma", "resource_id": "n6"},
    {"task_id": "2026-11-08-nychta", "resource_id": "n1"}
  ],
  "metadata": {"produced_by": "reviewer: independent CP-SAT probe", "notes": "reference solution for checker cross-check"}
}
