{
  "schema_version": "0.1",
  "model_id": "call-centre-2026-w50",
  "model_version": 1,
  "assignments": [
    {"task_id": "mon-early", "resource_id": "A02"},
    {"task_id": "mon-early", "resource_id": "A09"},
    {"task_id": "mon-mid", "resource_id": "A01"},
    {"task_id": "mon-late", "resource_id": "A06"},
    {"task_id": "mon-late", "resource_id": "A08"},
    {"task_id": "tue-early", "resource_id": "A03"},
    {"task_id": "tue-early", "resource_id": "A04"},
    {"task_id": "tue-mid", "resource_id": "A09"},
    {"task_id": "tue-late", "resource_id": "A01"},
    {"task_id": "tue-late", "resource_id": "A02"},
    {"task_id": "wed-early", "resource_id": "A03"},
    {"task_id": "wed-early", "resource_id": "A04"},
    {"task_id": "wed-mid", "resource_id": "A09"},
    {"task_id": "wed-late", "resource_id": "A02"},
    {"task_id": "wed-late", "resource_id": "A06"},
    {"task_id": "thu-early", "resource_id": "A03"},
    {"task_id": "thu-early", "resource_id": "A04"},
    {"task_id": "thu-mid", "resource_id": "A09"},
    {"task_id": "thu-late", "resource_id": "A01"},
    {"task_id": "thu-late", "resource_id": "A06"},
    {"task_id": "fri-early", "resource_id": "A02"},
    {"task_id": "fri-early", "resource_id": "A09"},
    {"task_id": "fri-mid", "resource_id": "A06"},
    {"task_id": "fri-late", "resource_id": "A01"},
    {"task_id": "fri-late", "resource_id": "A08"},
    {"task_id": "sat-day", "resource_id": "A01"},
    {"task_id": "sat-day", "resource_id": "A07"},
    {"task_id": "sun-day", "resource_id": "A02"},
    {"task_id": "sun-day", "resource_id": "A07"}
  ],
  "metadata": {"produced_by": "TASK-005b review reference search (checker as oracle)", "notes": "simulated annealing from a random start, 40000 iterations, seed 3, objective = potakt checker score (hard x 10000 + soft) with each weekday shift without a Spanish speaker counted as a hard violation; honours the unsupported request; optimal among such plans (exact search in the TASK-005b review)"}
}
