{
  "schema_version": "0.1",
  "model_id": "restaurant-2026-w49",
  "model_version": 1,
  "assignments": [
    {"task_id": "tue-kitchen-lunch", "resource_id": "K4"},
    {"task_id": "tue-kitchen-lunch", "resource_id": "K6"},
    {"task_id": "tue-floor-lunch", "resource_id": "F4"},
    {"task_id": "tue-floor-lunch", "resource_id": "K5"},
    {"task_id": "tue-kitchen-dinner", "resource_id": "K2"},
    {"task_id": "tue-kitchen-dinner", "resource_id": "K3"},
    {"task_id": "tue-floor-dinner", "resource_id": "F5"},
    {"task_id": "tue-floor-dinner", "resource_id": "F6"},
    {"task_id": "wed-kitchen-lunch", "resource_id": "K2"},
    {"task_id": "wed-kitchen-lunch", "resource_id": "K4"},
    {"task_id": "wed-floor-lunch", "resource_id": "F1"},
    {"task_id": "wed-floor-lunch", "resource_id": "F2"},
    {"task_id": "wed-kitchen-dinner", "resource_id": "K1"},
    {"task_id": "wed-kitchen-dinner", "resource_id": "K5"},
    {"task_id": "wed-floor-dinner", "resource_id": "F4"},
    {"task_id": "wed-floor-dinner", "resource_id": "F6"},
    {"task_id": "thu-kitchen-lunch", "resource_id": "K1"},
    {"task_id": "thu-kitchen-lunch", "resource_id": "K5"},
    {"task_id": "thu-floor-lunch", "resource_id": "F3"},
    {"task_id": "thu-floor-lunch", "resource_id": "F5"},
    {"task_id": "thu-kitchen-dinner", "resource_id": "K4"},
    {"task_id": "thu-kitchen-dinner", "resource_id": "K6"},
    {"task_id": "thu-floor-dinner", "resource_id": "F1"},
    {"task_id": "thu-floor-dinner", "resource_id": "F2"},
    {"task_id": "fri-kitchen-lunch", "resource_id": "K1"},
    {"task_id": "fri-kitchen-lunch", "resource_id": "K4"},
    {"task_id": "fri-floor-lunch", "resource_id": "F3"},
    {"task_id": "fri-floor-lunch", "resource_id": "F6"},
    {"task_id": "fri-kitchen-dinner", "resource_id": "K2"},
    {"task_id": "fri-kitchen-dinner", "resource_id": "K3"},
    {"task_id": "fri-kitchen-dinner", "resource_id": "K6"},
    {"task_id": "fri-floor-dinner", "resource_id": "F1"},
    {"task_id": "fri-floor-dinner", "resource_id": "F2"},
    {"task_id": "fri-floor-dinner", "resource_id": "F4"},
    {"task_id": "sat-kitchen-lunch", "resource_id": "K1"},
    {"task_id": "sat-kitchen-lunch", "resource_id": "K5"},
    {"task_id": "sat-floor-lunch", "resource_id": "F3"},
    {"task_id": "sat-floor-lunch", "resource_id": "F4"},
    {"task_id": "sat-kitchen-dinner", "resource_id": "K2"},
    {"task_id": "sat-kitchen-dinner", "resource_id": "K3"},
    {"task_id": "sat-kitchen-dinner", "resource_id": "K6"},
    {"task_id": "sat-floor-dinner", "resource_id": "F1"},
    {"task_id": "sat-floor-dinner", "resource_id": "F2"},
    {"task_id": "sat-floor-dinner", "resource_id": "F5"},
    {"task_id": "sun-kitchen", "resource_id": "K4"},
    {"task_id": "sun-kitchen", "resource_id": "K5"},
    {"task_id": "sun-floor", "resource_id": "F3"},
    {"task_id": "sun-floor", "resource_id": "F5"},
    {"task_id": "sun-floor", "resource_id": "F6"}
  ],
  "metadata": {"produced_by": "TASK-005a reference search (checker as oracle)", "notes": "simulated annealing, 30000 iterations, seed 1, objective = potakt checker score (hard x 10000 + soft); best found, not proven optimal"}
}
