{
  "schema_version": "0.1",
  "model_id": "supermarket-checkouts-2026-w51",
  "model_version": 1,
  "assignments": [
    {"task_id": "14-Π", "resource_id": "Τ1"},
    {"task_id": "14-Π", "resource_id": "Τ3"},
    {"task_id": "14-Α", "resource_id": "Τ2"},
    {"task_id": "14-Α", "resource_id": "Τ4"},
    {"task_id": "14-Α", "resource_id": "Τ9"},
    {"task_id": "15-Π", "resource_id": "Τ1"},
    {"task_id": "15-Π", "resource_id": "Τ6"},
    {"task_id": "15-Α", "resource_id": "Τ2"},
    {"task_id": "15-Α", "resource_id": "Τ4"},
    {"task_id": "15-Α", "resource_id": "Τ5"},
    {"task_id": "16-Π", "resource_id": "Τ8"},
    {"task_id": "16-Π", "resource_id": "Τ9"},
    {"task_id": "16-Α", "resource_id": "Τ2"},
    {"task_id": "16-Α", "resource_id": "Τ5"},
    {"task_id": "16-Α", "resource_id": "Τ6"},
    {"task_id": "17-Π", "resource_id": "Τ7"},
    {"task_id": "17-Π", "resource_id": "Τ8"},
    {"task_id": "17-Μ", "resource_id": "Τ5"},
    {"task_id": "17-Α", "resource_id": "Τ1"},
    {"task_id": "17-Α", "resource_id": "Τ3"},
    {"task_id": "17-Α", "resource_id": "Τ6"},
    {"task_id": "18-Π", "resource_id": "Τ2"},
    {"task_id": "18-Π", "resource_id": "Τ7"},
    {"task_id": "18-Μ", "resource_id": "Τ4"},
    {"task_id": "18-Α", "resource_id": "Τ3"},
    {"task_id": "18-Α", "resource_id": "Τ5"},
    {"task_id": "18-Α", "resource_id": "Τ9"},
    {"task_id": "19-Π", "resource_id": "Τ1"},
    {"task_id": "19-Π", "resource_id": "Τ4"},
    {"task_id": "19-Π", "resource_id": "Τ6"},
    {"task_id": "19-Μ", "resource_id": "Τ2"},
    {"task_id": "19-Α", "resource_id": "Τ5"},
    {"task_id": "19-Α", "resource_id": "Τ7"},
    {"task_id": "19-Α", "resource_id": "Τ8"},
    {"task_id": "20-Κ", "resource_id": "Τ1"},
    {"task_id": "20-Κ", "resource_id": "Τ3"},
    {"task_id": "20-Κ", "resource_id": "Τ9"}
  ],
  "metadata": {"produced_by": "TASK-005b reference search (checker as oracle)", "notes": "simulated annealing, 20000 iterations, seed 2, objective = potakt checker score (hard x 10000 + soft); best found, not proven optimal"}
}
