{
  "schema_version": "0.1",
  "model_id": "security-guards-2026-w45",
  "model_version": 1,
  "assignments": [
    {"task_id": "02-Η", "resource_id": "Φ1"},
    {"task_id": "02-Η", "resource_id": "Φ6"},
    {"task_id": "02-Ν", "resource_id": "Φ3"},
    {"task_id": "02-Ν", "resource_id": "Φ4"},
    {"task_id": "03-Η", "resource_id": "Φ5"},
    {"task_id": "03-Η", "resource_id": "Φ7"},
    {"task_id": "03-Ν", "resource_id": "Φ1"},
    {"task_id": "03-Ν", "resource_id": "Φ6"},
    {"task_id": "04-Η", "resource_id": "Φ3"},
    {"task_id": "04-Η", "resource_id": "Φ5"},
    {"task_id": "04-Ν", "resource_id": "Φ6"},
    {"task_id": "04-Ν", "resource_id": "Φ7"},
    {"task_id": "05-Η", "resource_id": "Φ1"},
    {"task_id": "05-Η", "resource_id": "Φ4"},
    {"task_id": "05-Ν", "resource_id": "Φ2"},
    {"task_id": "05-Ν", "resource_id": "Φ5"},
    {"task_id": "06-Η", "resource_id": "Φ3"},
    {"task_id": "06-Η", "resource_id": "Φ4"},
    {"task_id": "06-Ν", "resource_id": "Φ2"},
    {"task_id": "06-Ν", "resource_id": "Φ7"},
    {"task_id": "07-Η", "resource_id": "Φ6"},
    {"task_id": "07-Ν", "resource_id": "Φ1"},
    {"task_id": "07-Ν", "resource_id": "Φ4"},
    {"task_id": "08-Η", "resource_id": "Φ2"},
    {"task_id": "08-Ν", "resource_id": "Φ3"},
    {"task_id": "08-Ν", "resource_id": "Φ5"}
  ],
  "metadata": {"produced_by": "TASK-005b reference search (checker as oracle)", "notes": "simulated annealing, 15000 iterations, seed 1, objective = potakt checker score (hard x 10000 + soft); best found, not proven optimal"}
}
