{
  "schema_version": "0.1",
  "model_id": "retail-en-2026-w45",
  "model_version": 1,
  "assignments": [
    {"task_id": "mon-open", "resource_id": "s2"},
    {"task_id": "mon-open", "resource_id": "s6"},
    {"task_id": "mon-mid", "resource_id": "s5"},
    {"task_id": "mon-close", "resource_id": "s1"},
    {"task_id": "mon-close", "resource_id": "s3"},
    {"task_id": "tue-open", "resource_id": "s1"},
    {"task_id": "tue-open", "resource_id": "s4"},
    {"task_id": "tue-mid", "resource_id": "s7"},
    {"task_id": "tue-close", "resource_id": "s3"},
    {"task_id": "tue-close", "resource_id": "s8"},
    {"task_id": "wed-open", "resource_id": "s4"},
    {"task_id": "wed-open", "resource_id": "s6"},
    {"task_id": "wed-mid", "resource_id": "s2"},
    {"task_id": "wed-close", "resource_id": "s5"},
    {"task_id": "wed-close", "resource_id": "s8"},
    {"task_id": "thu-open", "resource_id": "s2"},
    {"task_id": "thu-open", "resource_id": "s4"},
    {"task_id": "thu-mid", "resource_id": "s7"},
    {"task_id": "thu-close", "resource_id": "s5"},
    {"task_id": "thu-close", "resource_id": "s8"},
    {"task_id": "fri-open", "resource_id": "s4"},
    {"task_id": "fri-open", "resource_id": "s8"},
    {"task_id": "fri-mid", "resource_id": "s2"},
    {"task_id": "fri-close", "resource_id": "s1"},
    {"task_id": "fri-close", "resource_id": "s3"},
    {"task_id": "sat-open", "resource_id": "s4"},
    {"task_id": "sat-open", "resource_id": "s6"},
    {"task_id": "sat-mid", "resource_id": "s7"},
    {"task_id": "sat-close", "resource_id": "s1"},
    {"task_id": "sat-close", "resource_id": "s3"},
    {"task_id": "sun-open", "resource_id": "s2"},
    {"task_id": "sun-open", "resource_id": "s6"},
    {"task_id": "sun-close", "resource_id": "s5"},
    {"task_id": "sun-close", "resource_id": "s8"}
  ],
  "metadata": {"produced_by": "reviewer: independent CP-SAT probe", "notes": "reference solution for checker cross-check"}
}
