{
  "schema_version": "0.1",
  "model_id": "warehouse-peak-2026-w48",
  "model_version": 1,
  "assignments": [
    {"task_id": "mon-early-pick", "resource_id": "W04"},
    {"task_id": "mon-early-pick", "resource_id": "W09"},
    {"task_id": "mon-early-flt", "resource_id": "W03"},
    {"task_id": "mon-late-pick", "resource_id": "W06"},
    {"task_id": "mon-late-pick", "resource_id": "W10"},
    {"task_id": "mon-late-flt", "resource_id": "W01"},
    {"task_id": "tue-early-pick", "resource_id": "W02"},
    {"task_id": "tue-early-pick", "resource_id": "W09"},
    {"task_id": "tue-early-flt", "resource_id": "W05"},
    {"task_id": "tue-late-pick", "resource_id": "W06"},
    {"task_id": "tue-late-pick", "resource_id": "W11"},
    {"task_id": "tue-late-flt", "resource_id": "W01"},
    {"task_id": "wed-early-pick", "resource_id": "W08"},
    {"task_id": "wed-early-pick", "resource_id": "W10"},
    {"task_id": "wed-early-flt", "resource_id": "W07"},
    {"task_id": "wed-late-pick", "resource_id": "W02"},
    {"task_id": "wed-late-pick", "resource_id": "W11"},
    {"task_id": "wed-late-flt", "resource_id": "W01"},
    {"task_id": "wed-night-pick", "resource_id": "W09"},
    {"task_id": "wed-night-flt", "resource_id": "W05"},
    {"task_id": "thu-early-pick", "resource_id": "W06"},
    {"task_id": "thu-early-pick", "resource_id": "W08"},
    {"task_id": "thu-early-flt", "resource_id": "W03"},
    {"task_id": "thu-late-pick", "resource_id": "W02"},
    {"task_id": "thu-late-pick", "resource_id": "W11"},
    {"task_id": "thu-late-flt", "resource_id": "W07"},
    {"task_id": "thu-night-pick", "resource_id": "W04"},
    {"task_id": "thu-night-flt", "resource_id": "W05"},
    {"task_id": "fri-early-pick", "resource_id": "W08"},
    {"task_id": "fri-early-pick", "resource_id": "W09"},
    {"task_id": "fri-early-flt", "resource_id": "W03"},
    {"task_id": "fri-late-pick", "resource_id": "W06"},
    {"task_id": "fri-late-pick", "resource_id": "W11"},
    {"task_id": "fri-late-flt", "resource_id": "W07"},
    {"task_id": "fri-night-pick", "resource_id": "W04"},
    {"task_id": "fri-night-flt", "resource_id": "W10"},
    {"task_id": "sat-early-pick", "resource_id": "W01"},
    {"task_id": "sat-early-pick", "resource_id": "W05"},
    {"task_id": "sat-early-flt", "resource_id": "W03"},
    {"task_id": "sat-late-pick", "resource_id": "W06"},
    {"task_id": "sat-late-pick", "resource_id": "W11"},
    {"task_id": "sat-late-flt", "resource_id": "W07"},
    {"task_id": "sat-night-pick", "resource_id": "W09"},
    {"task_id": "sat-night-flt", "resource_id": "W10"},
    {"task_id": "sun-early-pick", "resource_id": "W08"},
    {"task_id": "sun-early-flt", "resource_id": "W01"},
    {"task_id": "sun-late-pick", "resource_id": "W03"},
    {"task_id": "sun-late-flt", "resource_id": "W07"}
  ],
  "metadata": {"produced_by": "TASK-005b reference search (checker as oracle)", "notes": "simulated annealing, 15000 iterations, seed 1, objective = potakt checker score (hard x 10000 + soft); best found, not proven optimal"}
}
