{
  "schema_version": "0.1",
  "model_id": "municipal-nursery-2026-w51",
  "model_version": 1,
  "assignments": [
    {"task_id": "14-Β-ΠΡ-Π", "resource_id": "Π4"},
    {"task_id": "14-Β-ΠΡ-Β", "resource_id": "Π2"},
    {"task_id": "14-Β-ΑΠ-Π", "resource_id": "Π5"},
    {"task_id": "14-Β-ΑΠ-Β", "resource_id": "Β2"},
    {"task_id": "14-Ν-ΠΡ-Π", "resource_id": "Π3"},
    {"task_id": "14-Ν-ΠΡ-Β", "resource_id": "Β1"},
    {"task_id": "14-Ν-ΑΠ-Π", "resource_id": "Π1"},
    {"task_id": "14-Ν-ΑΠ-Β", "resource_id": "Β4"},
    {"task_id": "15-Β-ΠΡ-Π", "resource_id": "Π2"},
    {"task_id": "15-Β-ΠΡ-Β", "resource_id": "Β4"},
    {"task_id": "15-Β-ΑΠ-Π", "resource_id": "Π3"},
    {"task_id": "15-Β-ΑΠ-Β", "resource_id": "Β3"},
    {"task_id": "15-Ν-ΠΡ-Π", "resource_id": "Π4"},
    {"task_id": "15-Ν-ΠΡ-Β", "resource_id": "Β2"},
    {"task_id": "15-Ν-ΑΠ-Π", "resource_id": "Π1"},
    {"task_id": "15-Ν-ΑΠ-Β", "resource_id": "Β1"},
    {"task_id": "16-Β-ΠΡ-Π", "resource_id": "Π3"},
    {"task_id": "16-Β-ΠΡ-Β", "resource_id": "Π2"},
    {"task_id": "16-Β-ΑΠ-Π", "resource_id": "Π4"},
    {"task_id": "16-Β-ΑΠ-Β", "resource_id": "Β3"},
    {"task_id": "16-Ν-ΠΡ-Π", "resource_id": "Π1"},
    {"task_id": "16-Ν-ΠΡ-Β", "resource_id": "Β4"},
    {"task_id": "16-Ν-ΑΠ-Π", "resource_id": "Π5"},
    {"task_id": "16-Ν-ΑΠ-Β", "resource_id": "Β1"},
    {"task_id": "16-ΓΙΟΡΤΗ", "resource_id": "Β2"},
    {"task_id": "16-ΓΙΟΡΤΗ", "resource_id": "Π2"},
    {"task_id": "16-ΓΙΟΡΤΗ", "resource_id": "Π4"},
    {"task_id": "17-Β-ΠΡ-Π", "resource_id": "Π5"},
    {"task_id": "17-Β-ΠΡ-Β", "resource_id": "Β1"},
    {"task_id": "17-Β-ΑΠ-Π", "resource_id": "Π3"},
    {"task_id": "17-Β-ΑΠ-Β", "resource_id": "Β2"},
    {"task_id": "17-Ν-ΠΡ-Π", "resource_id": "Π1"},
    {"task_id": "17-Ν-ΠΡ-Β", "resource_id": "Β4"},
    {"task_id": "17-Ν-ΑΠ-Π", "resource_id": "Π4"},
    {"task_id": "17-Ν-ΑΠ-Β", "resource_id": "Β3"},
    {"task_id": "18-Β-ΠΡ-Π", "resource_id": "Π5"},
    {"task_id": "18-Β-ΠΡ-Β", "resource_id": "Β3"},
    {"task_id": "18-Β-ΑΠ-Π", "resource_id": "Π1"},
    {"task_id": "18-Β-ΑΠ-Β", "resource_id": "Β4"},
    {"task_id": "18-Ν-ΠΡ-Π", "resource_id": "Π2"},
    {"task_id": "18-Ν-ΠΡ-Β", "resource_id": "Β1"},
    {"task_id": "18-Ν-ΑΠ-Π", "resource_id": "Π3"},
    {"task_id": "18-Ν-ΑΠ-Β", "resource_id": "Β2"}
  ],
  "metadata": {"produced_by": "TASK-005b reference search (checker as oracle)", "notes": "simulated annealing, 20000 iterations, seed 1, objective = potakt checker score (hard x 10000 + soft); best found, not proven optimal"}
}
