{
  "schema_version": "0.1",
  "model_id": "care-home-2026-w50",
  "model_version": 1,
  "assignments": [
    {"task_id": "mon-day-senior", "resource_id": "S06"},
    {"task_id": "mon-day-carer", "resource_id": "S05"},
    {"task_id": "mon-day-carer", "resource_id": "S10"},
    {"task_id": "mon-twilight", "resource_id": "S04"},
    {"task_id": "mon-night-senior", "resource_id": "S07"},
    {"task_id": "mon-night-carer", "resource_id": "S03"},
    {"task_id": "tue-day-senior", "resource_id": "S05"},
    {"task_id": "tue-day-carer", "resource_id": "S01"},
    {"task_id": "tue-day-carer", "resource_id": "S02"},
    {"task_id": "tue-twilight", "resource_id": "S11"},
    {"task_id": "tue-night-senior", "resource_id": "S06"},
    {"task_id": "tue-night-carer", "resource_id": "S09"},
    {"task_id": "wed-day-senior", "resource_id": "S08"},
    {"task_id": "wed-day-carer", "resource_id": "S10"},
    {"task_id": "wed-day-carer", "resource_id": "S12"},
    {"task_id": "wed-twilight", "resource_id": "S05"},
    {"task_id": "wed-night-senior", "resource_id": "S11"},
    {"task_id": "wed-night-carer", "resource_id": "S09"},
    {"task_id": "thu-day-senior", "resource_id": "S07"},
    {"task_id": "thu-day-carer", "resource_id": "S01"},
    {"task_id": "thu-day-carer", "resource_id": "S02"},
    {"task_id": "thu-twilight", "resource_id": "S12"},
    {"task_id": "thu-night-senior", "resource_id": "S06"},
    {"task_id": "thu-night-carer", "resource_id": "S03"},
    {"task_id": "fri-day-senior", "resource_id": "S08"},
    {"task_id": "fri-day-carer", "resource_id": "S01"},
    {"task_id": "fri-day-carer", "resource_id": "S02"},
    {"task_id": "fri-twilight", "resource_id": "S09"},
    {"task_id": "fri-night-senior", "resource_id": "S07"},
    {"task_id": "fri-night-carer", "resource_id": "S04"},
    {"task_id": "sat-day-senior", "resource_id": "S06"},
    {"task_id": "sat-day-carer", "resource_id": "S03"},
    {"task_id": "sat-day-carer", "resource_id": "S10"},
    {"task_id": "sat-twilight", "resource_id": "S08"},
    {"task_id": "sat-night-senior", "resource_id": "S07"},
    {"task_id": "sat-night-carer", "resource_id": "S11"},
    {"task_id": "sun-day-senior", "resource_id": "S05"},
    {"task_id": "sun-day-carer", "resource_id": "S03"},
    {"task_id": "sun-day-carer", "resource_id": "S12"},
    {"task_id": "sun-twilight", "resource_id": "S10"},
    {"task_id": "sun-night-senior", "resource_id": "S06"},
    {"task_id": "sun-night-carer", "resource_id": "S04"}
  ],
  "metadata": {"produced_by": "TASK-005b review reference search (exact, checker as oracle)", "notes": "exact optimum: CP-SAT over the hard rules with the checker's soft objective, every solution re-scored by potakt check; among the optimal plans, the one closest to the previous reference in which S10 works during the disruption window"}
}
